{
  "blocked_reason": null,
  "blocking_errors": [],
  "claim": "independent_source_content_fidelity",
  "claim_limitations": [],
  "comparison_version": "independent-content-comparison-v2",
  "coverage": {
    "blocked": 0,
    "completed": 1,
    "failed": 0,
    "passed": 1,
    "required": 1
  },
  "evidence_semantic_identity": {
    "algorithm": "sha256-canonical-json-v1",
    "sha256": "18417833eb49e9b621acb7fc55496db805318988320efa151ddee868241b8540"
  },
  "identity": {
    "batch_id": "20260812T125640Z-e5aa4b3f",
    "item_id": "en-us/service-bus",
    "language": "en-us",
    "page_family": "simple_static",
    "product_key": "service-bus",
    "resource_key": "service-bus"
  },
  "mismatches": [],
  "reconstruction_basis": {
    "basis_id": "v0.5.3-20260812T125640Z-e5aa4b3f-en-us-service-bus-basis",
    "basis_semantic_identity": {
      "algorithm": "sha256-canonical-json-v1",
      "sha256": "8f678b0cd3e0e78341eead2eb5bebac58dac934e6dd007028a62e4c9fe2044fa"
    },
    "batch_binding": {
      "batch_id": "20260812T125640Z-e5aa4b3f",
      "batch_manifest": {
        "path": "runs/20260812T125640Z-e5aa4b3f/batch-manifest.json",
        "revision": 1483,
        "sha256": "0c23600632c2e49e8d142ab648b9e2cdeb2b3946b469894ff6354df591a3d893"
      },
      "input_manifest": {
        "path": "runs/20260812T125640Z-e5aa4b3f/input-manifest.json",
        "sha256": "efc296cf59bdaa861953fc8cfa8371e82e32950a4537b43d5a024644d0b592b8"
      },
      "producer_commit": "de7ea08518bb54e180e059007a9522d8301e2371"
    },
    "comparison_version": "independent-content-comparison-v2",
    "item_identity": {
      "item_id": "en-us/service-bus",
      "language": "en-us",
      "page_family": "simple_static",
      "product_key": "service-bus",
      "resource_key": "service-bus",
      "resource_kind": "current"
    },
    "persisted_payload_identity": {
      "batch_revision": 1483,
      "path": "runs/20260812T125640Z-e5aa4b3f/outputs/en-us/pricing/service-bus.json",
      "sha256": "6264337d8a8b4b1c17a9f916d0d669f08a4fb9f1aa6b7b52c0c31d7e1b8de7d2"
    },
    "product_definition_identity": {
      "path": "data/configs/products/pricing/service-bus.json",
      "sha256": "7dad4a1ba650a9394c6fb099cd3883ef1e4761e920329a706053c53ae48a7989"
    },
    "reconstruction_profile_version": "independent-four-family-reconstruction-v1",
    "route_map_basis": null,
    "schema_version": "1.1",
    "scopes": [
      {
        "criteria": [],
        "expected_group_name": null,
        "payload_locator": "baseContent",
        "removed_table_ids": [],
        "retained_table_ids": [],
        "scope_key": "full_content",
        "scope_kind": "full_content",
        "source_locator": {
          "boundary": "sole_static_formal_selector_before_common_sections",
          "kind": "selector",
          "selector": "div.technical-azure-selector"
        }
      }
    ],
    "soft_category_identity": null,
    "source_identity": {
      "path": "data/current_prod_html/en-us/pricing/details/service-bus/index.html",
      "sha256": "715b7014993d2e00e5c04643fbe05a9c0b8592c6d243865ac286dc8c36bcbb6f"
    },
    "verifier_profile": {
      "id": "v0.5.3-independent-fidelity-four-family",
      "path": "data/configs/independent-fidelity-profiles/v0.5.3-four-family.json",
      "sha256": "6a3c6c0fcb93105e2540a88229c302317ae48b4b5d8ea2a1fcf75f196b029f0c",
      "version": "0.5.3"
    },
    "wire_transform_version": "independent-cms-wire-v2"
  },
  "reconstruction_profile_version": "independent-four-family-reconstruction-v1",
  "schema_version": "1.1",
  "scopes": [
    {
      "applied_transform_rule_ids": [
        "css-generated-semantics-v1"
      ],
      "blocking_errors": [],
      "criteria": [],
      "diff": {
        "path": "fragments/scope-001.diff.txt",
        "sha256": "e3b0c44298fc1c149afbf4c8996fb92427ae41e4649b934ca495991b7852b855"
      },
      "expected": {
        "path": "fragments/scope-001.expected.html.txt",
        "sha256": "8833f9a6b4746d7bfc4747a9d42d82698c93e96fa5551f89de0e5a87d287639e"
      },
      "expected_group_name": null,
      "mismatches": [],
      "payload": {
        "path": "fragments/scope-001.payload.html.txt",
        "sha256": "8833f9a6b4746d7bfc4747a9d42d82698c93e96fa5551f89de0e5a87d287639e"
      },
      "payload_locator": "baseContent",
      "removed_table_ids": [],
      "retained_table_ids": [],
      "scope_key": "full_content",
      "scope_kind": "full_content",
      "source": {
        "path": "fragments/scope-001.source.html.txt",
        "sha256": "8f05d669c13e2daa02d968b50dcf5ec31f6f342f2c9e1d8f67131682637488ea"
      },
      "source_locator": {
        "boundary": "sole_static_formal_selector_before_common_sections",
        "kind": "selector",
        "selector": "div.technical-azure-selector"
      },
      "verdict": "passed"
    }
  ],
  "verdict": "passed",
  "verifier_profile": {
    "id": "v0.5.3-independent-fidelity-four-family",
    "path": "data/configs/independent-fidelity-profiles/v0.5.3-four-family.json",
    "sha256": "6a3c6c0fcb93105e2540a88229c302317ae48b4b5d8ea2a1fcf75f196b029f0c",
    "version": "0.5.3"
  },
  "wire_transform_version": "independent-cms-wire-v2"
}
